{
  "schemaVersion": "1.0",
  "traceId": "dcbfbfe6-a2c2-4da1-8684-8a27555c9836",
  "runId": "th-foundation-inventory-remediation-20260714-002",
  "sliceId": "foundation-inventory",
  "stageId": "02",
  "skillName": "stoquify-transaction-history-02-security-proof-gate",
  "agentType": "Security Architect",
  "mode": "implement",
  "status": "PASS",
  "activeLanes": [
    "workbench",
    "inventory"
  ],
  "blockedLanes": [],
  "inputArtifacts": [
    {
      "path": "what-next/transaction-history/runs/th-foundation-inventory-remediation-20260714-002/run-manifest.json",
      "sha256": "sha256:b35d28d43d3c90da80a6e33207d26982ee339a1131a5c3bb93235369360e9378"
    },
    {
      "path": "what-next/transaction-history/runs/th-foundation-inventory-remediation-20260714-002/slices/foundation-inventory/01-architecture-gate.json",
      "sha256": "sha256:755987bdc9263c6eb5b9c568a9aa7b1696370cdd4a3f42d8280a1f9d3c6344e1"
    },
    {
      "path": "what-next/transaction-history/runs/th-foundation-inventory-remediation-20260714-002/slices/foundation-inventory/01-architecture-gate.md",
      "sha256": "sha256:0626a4394c3035d3bddb5fe0257e1f9383851087560922ab5ed3eec1e9f828e5"
    }
  ],
  "inputFingerprint": "sha256:3fb9c59cac2ba2596482fad61ba8893cf1e7705e74bf44678fdb31dbb8ba39e6",
  "allowedEdits": [
    "what-next/transaction-history/runs/th-foundation-inventory-remediation-20260714-002/slices/foundation-inventory/02-security-proof-gate.json",
    "what-next/transaction-history/runs/th-foundation-inventory-remediation-20260714-002/slices/foundation-inventory/02-security-proof-gate.md"
  ],
  "observedEdits": [
    "what-next/transaction-history/runs/th-foundation-inventory-remediation-20260714-002/slices/foundation-inventory/02-security-proof-gate.md",
    "what-next/transaction-history/runs/th-foundation-inventory-remediation-20260714-002/slices/foundation-inventory/02-security-proof-gate.json"
  ],
  "repository": {
    "headBefore": "5cf02043eed4fbfb7e6e1bb3b1a4c87683965e2d",
    "headAfter": "5cf02043eed4fbfb7e6e1bb3b1a4c87683965e2d",
    "dirtyFilesBefore": [
      ".github/workflows/ci.yml",
      "actions/hris/__tests__/employee.actions.test.ts",
      "actions/hris/employee.actions.ts",
      "actions/hris/lifecycle.actions.ts",
      "actions/inventory/__tests__/inventoryMovementActions.test.ts",
      "actions/inventory/inventoryMovementActions.ts",
      "actions/purchaseOrderWorkflow/purchaseOrderSystemAction.ts",
      "app/[locale]/(dashboard)/dashboard/people/__tests__/page.test.tsx",
      "app/[locale]/(dashboard)/dashboard/people/[employeeId]/__tests__/page.test.tsx",
      "app/[locale]/(dashboard)/dashboard/people/[employeeId]/page.tsx",
      "app/[locale]/(dashboard)/dashboard/people/page.tsx",
      "config/__tests__/permissions.test.ts",
      "config/__tests__/sidebar.test.ts",
      "config/permissions.ts",
      "config/sidebar.ts",
      "docs/architecture/system/ARCHITECTURE.md",
      "docs/HR-Payroll/AQSTOQFLOW_ENTERPRISE_HRIS_PAYROLL_EXECUTION_PROMPT_2026-07-12.md",
      "docs/HR-Payroll/AQSTOQFLOW_ENTERPRISE_HRIS_PAYROLL_EXECUTION_ROADMAP_2026-07-12.md",
      "docs/HR-Payroll/AQSTOQFLOW_HR_PAYROLL_SYSTEM_DEEP_ANALYSIS_2026-07-12.md",
      "docs/HR-Payroll/AQSTOQFLOW_HRIS_PAYROLL_SKILL_SYSTEM_BLUEPRINT_2026-07-12.md",
      "docs/HR-Payroll/AQSTOQFLOW_HRIS_PAYROLL_SKILL_SYSTEM_PROMPT_2026-07-12.md",
      "docs/HR-Payroll/AQSTOQFLOW_PAYROLL_GRADE_HRIS_FIRST_BLUEPRINT_2026-07-12.md",
      "docs/HR-Payroll/README.md",
      "docs/HR-Payroll/STOQUIFY_ENTERPRISE_HRIS_IMPLEMENTATION_ANALYSIS_2026-07-14.md",
      "docs/HR-Payroll/STOQUIFY_ENTERPRISE_HRIS_IMPLEMENTATION_ANALYSIS_PROMPT_2026-07-14.md",
      "docs/HR-Payroll/STOQUIFY_ENTERPRISE_HRIS_TARGETED_SKILL_SYSTEM_2026-07-14.md",
      "docs/missing/needed.md",
      "docs/modules/AQSTOQFLOW_CANONICAL_MODULE_VOCABULARY_2026-07-12.md",
      "docs/modules/AQSTOQFLOW_COMPLETE_MODULE_SYSTEM_ENTERPRISE_ROADMAP_2026-07-12.md",
      "docs/modules/AQSTOQFLOW_MODULE_ACCESS_GUARD_CONTRACT_2026-07-12.md",
      "docs/modules/AQSTOQFLOW_MODULE_BILLING_PROVISIONING_BOUNDARY_2026-07-12.md",
      "docs/modules/AQSTOQFLOW_MODULE_CONTROL_PLANE_NEXT_IMPLEMENTATION_PROMPT_2026-07-12.md",
      "docs/modules/AQSTOQFLOW_MODULE_CONTROL_PLANE_ORCHESTRATOR_PILOT_RUN_2026-07-12.md",
      "docs/modules/AQSTOQFLOW_MODULE_DEPENDENCY_MATRIX_2026-07-12.md",
      "docs/modules/AQSTOQFLOW_MODULE_ENFORCEMENT_PILOT_PLAN_2026-07-12.md",
      "docs/modules/AQSTOQFLOW_MODULE_ENTITLEMENT_SCHEMA_AND_MIGRATION_PLAN_2026-07-12.md",
      "docs/modules/AQSTOQFLOW_MODULE_LEAKAGE_PREVENTION_2026-07-12.md",
      "docs/modules/AQSTOQFLOW_MODULE_PACKAGE_STRATEGY_2026-07-12.md",
      "docs/modules/AQSTOQFLOW_MODULE_RELEASE_GATES_AND_ROLLBACK_2026-07-12.md",
      "docs/modules/AQSTOQFLOW_MODULE_SURFACE_REGISTRY_RATCHET_2026-07-12.md",
      "docs/modules/AQSTOQFLOW_MODULE_SYSTEM_FULL_ARCHITECTURE_AUDIT_AND_REMEDIATION_REPORT_2026-07-12.md",
      "docs/modules/AQSTOQFLOW_MODULE_SYSTEM_SKILL_SUITE_CREATION_PROMPT_2026-07-12.md",
      "docs/modules/AQSTOQFLOW_MODULE_SYSTEM_SKILL_SUITE_INSTALL_AND_ORCHESTRATOR_PILOT_PROMPT_2026-07-12.md",
      "docs/modules/AQSTOQFLOW_MODULE_SYSTEM_SKILL_SUITE_INSTALLATION_REPORT_2026-07-12.md",
      "docs/modules/AQSTOQFLOW_MODULE_SYSTEM_TARGETED_SKILL_SUITE_BLUEPRINT_2026-07-12.md",
      "docs/modules/AQSTOQFLOW_MODULE_WORKBENCH_UX_STATES_2026-07-12.md",
      "docs/modules/README.md",
      "docs/new ideas/_skill-suite-staging/aqstoqflow-module-enforcement-truth/agents/openai.yaml",
      "docs/new ideas/_skill-suite-staging/aqstoqflow-module-enforcement-truth/SKILL.md",
      "docs/new ideas/_skill-suite-staging/aqstoqflow-module-program-status-register/agents/openai.yaml",
      "docs/new ideas/_skill-suite-staging/aqstoqflow-module-program-status-register/SKILL.md",
      "docs/new ideas/_skill-suite-staging/aqstoqflow-module-provider-shadow-reconciliation/agents/openai.yaml",
      "docs/new ideas/_skill-suite-staging/aqstoqflow-module-provider-shadow-reconciliation/SKILL.md",
      "docs/new ideas/_skill-suite-staging/aqstoqflow-module-security-prerequisites/agents/openai.yaml",
      "docs/new ideas/_skill-suite-staging/aqstoqflow-module-security-prerequisites/SKILL.md",
      "docs/new ideas/STOQUIFY_ENTERPRISE_HRIS_CURRENT_STATE_AND_FULL_SYSTEM_EXECUTION_PROMPT_2026-07-14.md",
      "docs/new ideas/STOQUIFY_ENTERPRISE_HRIS_CURRENT_STATE_AND_FULL_SYSTEM_PROPOSAL_2026-07-14.md",
      "docs/new ideas/STOQUIFY_ENTERPRISE_HRIS_CURRENT_STATE_AND_FULL_SYSTEM_PROPOSAL_2026-07-14.pdf",
      "docs/new ideas/STOQUIFY_MODULE_SYSTEM_CURRENT_STATE_AND_FULL_SYSTEM_EXECUTION_PROMPT_2026-07-14.md",
      "docs/new ideas/STOQUIFY_MODULE_SYSTEM_CURRENT_STATE_AND_FULL_SYSTEM_PROPOSAL_2026-07-14.md",
      "docs/new ideas/STOQUIFY_MODULE_SYSTEM_CURRENT_STATE_AND_FULL_SYSTEM_PROPOSAL_2026-07-14.pdf",
      "docs/new ideas/STOQUIFY_TRANSACTION_HISTORY_ANALYTICS_AND_SECURITY_EXECUTION_PROMPT_2026-07-14.md",
      "docs/new ideas/STOQUIFY_TRANSACTION_HISTORY_ANALYTICS_AND_SECURITY_PROPOSAL_2026-07-14.md",
      "docs/new ideas/STOQUIFY_TRANSACTION_HISTORY_ANALYTICS_AND_SECURITY_PROPOSAL_2026-07-14.pdf",
      "docs/operations/runbooks/ci-release-gates.md",
      "docs/operations/runbooks/RUNBOOK.md",
      "docs/skills-life-cycle/STOQUIFY_TRANSACTION_HISTORY_AGENT_SKILL_MATRIX_2026-07-14.md",
      "docs/skills-life-cycle/STOQUIFY_TRANSACTION_HISTORY_CURRENT_STATE_ASSESSMENT_2026-07-14.md",
      "docs/skills-life-cycle/STOQUIFY_TRANSACTION_HISTORY_EXECUTION_LEDGER_2026-07-14.md",
      "docs/skills-life-cycle/STOQUIFY_TRANSACTION_HISTORY_EXECUTION_ROADMAP_2026-07-14.md",
      "docs/skills-life-cycle/STOQUIFY_TRANSACTION_HISTORY_INCONSISTENCY_REGISTER_2026-07-14.md",
      "docs/skills-life-cycle/STOQUIFY_TRANSACTION_HISTORY_ORCHESTRATOR_EXECUTION_CONTRACT_2026-07-14.md",
      "docs/skills-life-cycle/STOQUIFY_TRANSACTION_HISTORY_READINESS_REPORT_2026-07-14.md",
      "docs/skills-life-cycle/STOQUIFY_TRANSACTION_HISTORY_SKILL_SUITE_CATALOG_2026-07-14.md",
      "docs/skills-life-cycle/STOQUIFY_TRANSACTION_HISTORY_SKILL_SUITE_INSTALLATION_REPORT_2026-07-14.md",
      "docs/skills-life-cycle/STOQUIFY_TRANSACTION_HISTORY_SKILL_SUITE_REVALIDATION_AND_EXECUTION_2026-07-14.md",
      "docs/skills-life-cycle/STOQUIFY_TRANSACTION_HISTORY_TRACEABILITY_MATRIX_2026-07-14.md",
      "docs/skills-life-cycle/stoquify-transaction-history-skill-suite-src/manifest.md",
      "docs/skills-life-cycle/stoquify-transaction-history-skill-suite-src/stoquify-transaction-history-00-orchestrator/agents/openai.yaml",
      "docs/skills-life-cycle/stoquify-transaction-history-skill-suite-src/stoquify-transaction-history-00-orchestrator/references/run-manifest.schema.json",
      "docs/skills-life-cycle/stoquify-transaction-history-skill-suite-src/stoquify-transaction-history-00-orchestrator/references/slice-ap-ar.md",
      "docs/skills-life-cycle/stoquify-transaction-history-skill-suite-src/stoquify-transaction-history-00-orchestrator/references/slice-cash-payment.md",
      "docs/skills-life-cycle/stoquify-transaction-history-skill-suite-src/stoquify-transaction-history-00-orchestrator/references/slice-foundation-inventory.md",
      "docs/skills-life-cycle/stoquify-transaction-history-skill-suite-src/stoquify-transaction-history-00-orchestrator/references/stage-evidence.schema.json",
      "docs/skills-life-cycle/stoquify-transaction-history-skill-suite-src/stoquify-transaction-history-00-orchestrator/scripts/select-next-stage.mjs",
      "docs/skills-life-cycle/stoquify-transaction-history-skill-suite-src/stoquify-transaction-history-00-orchestrator/scripts/select-next-stage.test.mjs",
      "docs/skills-life-cycle/stoquify-transaction-history-skill-suite-src/stoquify-transaction-history-00-orchestrator/scripts/validate-run-artifacts.mjs",